{
  "classification": {
    "document_category": "prescription",
    "is_electronic": false,
    "prescription_type": "standard"
  },
  "database_result": {
    "matched_existing_patient": false,
    "patient_id": null,
    "record_id": "rec_b4811b8a60864b0eacbf6a2f72adae3a",
    "success": true
  },
  "document_id": "doc_c8c42144b2c94bd490008d3dd1f13e4c",
  "extraction": {
    "clinical_info": {
      "diagnosis": [
        "fever"
      ],
      "icd_codes": [],
      "lab_results": {},
      "notes": null,
      "vital_signs": {}
    },
    "medications": [
      {
        "confidence": 0.85,
        "dosage": null,
        "duration": null,
        "form": null,
        "frequency": "bid",
        "instructions": "The patient was prescribed Amoxicillin 500mg bid.",
        "name": "The",
        "quantity": null,
        "refills": null,
        "route": null,
        "strength": "500mg"
      },
      {
        "confidence": 0.85,
        "dosage": null,
        "duration": null,
        "form": null,
        "frequency": "bid",
        "instructions": "The patient was prescribed Amoxicillin 500mg bid.",
        "name": "The",
        "quantity": null,
        "refills": null,
        "route": null,
        "strength": "500mg"
      },
      {
        "confidence": 0.85,
        "dosage": null,
        "duration": null,
        "form": null,
        "frequency": "daily",
        "instructions": "The patient's medication list includes Lisinopril 10mg daily and Metformin 500mg twice a day.",
        "name": "The",
        "quantity": null,
        "refills": null,
        "route": null,
        "strength": "10mg"
      },
      {
        "confidence": 0.85,
        "dosage": null,
        "duration": null,
        "form": null,
        "frequency": "daily",
        "instructions": "The patient's medication list includes Lisinopril 10mg daily and Metformin 500mg twice a day.",
        "name": "The",
        "quantity": null,
        "refills": null,
        "route": null,
        "strength": "10mg"
      },
      {
        "confidence": 0.85,
        "dosage": null,
        "duration": null,
        "form": null,
        "frequency": null,
        "instructions": "The patient's blood glucose level is 120 mg/dL.",
        "name": "The",
        "quantity": null,
        "refills": null,
        "route": null,
        "strength": "120mg"
      },
      {
        "confidence": 0.85,
        "dosage": null,
        "duration": null,
        "form": null,
        "frequency": null,
        "instructions": "The patient's blood glucose level is 120 mg/dL.",
        "name": "The",
        "quantity": null,
        "refills": null,
        "route": null,
        "strength": "120mg"
      },
      {
        "confidence": 0.85,
        "dosage": null,
        "duration": null,
        "form": null,
        "frequency": null,
        "instructions": "The patient's urine output is 500 mL over the past 8 hours.",
        "name": "The",
        "quantity": null,
        "refills": null,
        "route": null,
        "strength": "500mL"
      },
      {
        "confidence": 0.85,
        "dosage": null,
        "duration": null,
        "form": null,
        "frequency": null,
        "instructions": "The patient's urine output is 500 mL over the past 8 hours.",
        "name": "The",
        "quantity": null,
        "refills": null,
        "route": null,
        "strength": "500mL"
      }
    ],
    "metadata": {
      "date_filled": null,
      "date_written": null,
      "expiration_date": null,
      "is_electronic": false,
      "is_original": true,
      "language": "en",
      "prescription_number": null,
      "prescription_type": "standard"
    },
    "ml_entities_count": 0,
    "patient": {
      "address": null,
      "age": null,
      "allergies": [
        "status is unknown."
      ],
      "dob": null,
      "gender": null,
      "id": null,
      "insurance": null,
      "name": "was prescribed Amoxicillin",
      "phone": null
    },
    "pharmacy": {
      "address": null,
      "license": null,
      "name": null,
      "phone": null
    },
    "prescriber": {
      "address": null,
      "dea": null,
      "id": null,
      "license": null,
      "name": "the ab",
      "npi": null,
      "phone": null,
      "signature_present": false,
      "specialty": null
    },
    "refined_text": "A\nInput:\nTis a phisical examination of the abdominal area.\nCleaned:\nThis is a physical examination of the abdominal area.\nInput:\nThe patient was prescribed Amoxicillin 500mg bid.\nCleaned:\nThe patient was prescribed Amoxicillin 500mg bid.\nInput:\neaning from a recent fall, the patient presents with a suspected fracture of the left femur.\nCleaned:\nEarning from a recent fall, the patient presents with a suspected fracture of the left femur.\nInput:\nThe patient's symptoms include a mild headache and a slight fever.\nCleaned:\nThe patient's symptoms include a mild headache and a slight fever.\nInput:\nThe patient's vitals are stable, and he is in no acute distress.\nCleaned:\nThe patient's vitals are stable, and he is in no acute distress.\nInput:\nThe patient's ECG shows normal sinus rhythm with no significant ST-T changes.\nCleaned:\nThe patient's ECG shows normal sinus rhythm with no significant ST-T changes.\nInput:\nThe patient's blood pressure is 120/80 mmHg, and his pulse is 72 bpm.\nCleaned:\nThe patient's blood pressure is 120/80 mmHg, and his pulse is 72 bpm.\nInput:\nThe patient's lab results indicate elevated liver enzymes.\nCleaned:\nThe patient's lab results indicate elevated liver enzymes.\nInput:\nThe patient's history of present illness includes a persistent cough for the past two weeks.\nCleaned:\nThe patient's history of present illness includes a persistent cough for the past two weeks.\nInput:\nThe patient's medication list includes Lisinopril 10mg daily and Metformin 500mg twice a day.\nCleaned:\nThe patient's medication list includes Lisinopril 10mg daily and Metformin 500mg twice a day.\nInput:\nThe patient's family history is significant for hypertension and diabetes mellitus.\nCleaned:\nThe patient's family history is significant for hypertension and diabetes mellitus.\nInput:\nThe patient's chief complaint is shortness of breath and chest pain.\nCleaned:\nThe patient's chief complaint is shortness of breath and chest pain.\nInput:\nThe patient's allergy status is unknown.\nCleaned:\nThe patient's allergy status is unknown.\nInput:\nThe patient's social history includes smoking and occasional alcohol use.\nCleaned:\nThe patient's social history includes smoking and occasional alcohol use.\nInput:\nThe patient's current medications include \nCleaned:\nThe patient's current medications include \nInput:\nThe patient's last menstrual period was 6 weeks ago.\nCleaned:\nThe patient's last menstrual period was 6 weeks ago.\nInput:\nThe patient's physical examination reveals bilateral lower extremity edema.\nCleaned:\nThe patient's physical examination reveals bilateral lower extremity edema.\nInput:\nThe patient's neurological examination is normal.\nCleaned:\nThe patient's neurological examination is normal.\nInput:\nThe patient's oxygen saturation is 98% on room air.\nCleaned:\nThe patient's oxygen saturation is 98% on room air.\nInput:\nThe patient's respiratory rate is 16 breaths per minute.\nCleaned:\nThe patient's respiratory rate is 16 breaths per minute.\nInput:\nThe patient's temperature is 98.6\u00b0F.\nCleaned:\nThe patient's temperature is 98.6\u00b0F.\nInput:\nThe patient's weight is 180 pounds.\nCleaned:\nThe patient's weight is 180 pounds.\nInput:\nThe patient's height is 5 feet 10 inches.\nCleaned:\nThe patient's height is 5 feet 10 inches.\nInput:\nThe patient's blood glucose level is 120 mg/dL.\nCleaned:\nThe patient's blood glucose level is 120 mg/dL.\nInput:\nThe patient's urine output is 500 mL over the past 8 hours.\nCleaned:\nThe patient's urine output is 500 mL over the past 8 hours.\nInput:\nThe patient's skin turgor is normal.\nCleaned:\nThe patient's skin turgor is normal.\nInput:\nThe patient's blood pressure is 130/85 mmHgon the left arm.\nCleaned:\nThe patient's blood pressure is 130/85 mmHg on the left arm.\nInput:\nThe patient's blood pressure is 125/80 mmHg on the right arm.\nCleaned:\nThe patient's blood pressure is 125/80 mmHg on the right arm.\nInput:\nThe patient's blood pressure is 110/70 mmHg on the left leg.\nCleaned:\nThe patient's blood pressure is 110/70 mmHg on the left leg.\nInput:\nThe patient's blood pressure is 115/75 mmHg on the right leg.\nCleaned:\nThe patient's blood pressure is 115/75 mmHg on the right leg.\nInput:\nThe patient's blood pressure is 120/80 mmHg on the left arm.\nCleaned:\nThe patient's blood pressure is 120/80 mmHg on the left arm.\nInput:\nThe patient's blood pressure is 125/85 mmHg on the right arm.\nCleaned:\nThe patient's blood pressure is 125/85 mmHg on the right arm.\nInput:\nThe patient's blood pressure is 130/90 mmHg on the left leg.\nCleaned:\nThe patient's blood pressure is 130/90 mmHg on the left leg.\nInput:\nThe patient's blood pressure is 135/95 mmHg on the right leg.\nCleaned:\nThe patient's blood pressure is 135/95 mmHg on the right leg.\nInput:\nThe patient's blood pressure is 140/100 mmHg on the left arm.\nCleaned:\nThe patient's blood pressure is 140/100 mmHg on the left arm.\nInput:\nThe patient's blood pressure is 145/105 mmHg on the right arm.\nCleaned:\nThe patient's blood pressure is 145/105 mmHg on the right arm.\nInput:\nThe patient's blood pressure is 150/110 mmHg on the left leg.\nCleaned:\nThe patient's blood pressure is 150/110 mmHg on the left leg.\nInput:\nThe patient's blood pressure is 155/115 mmHg on the right leg.\nCleaned:\nThe patient's blood pressure is 155/115 mmHg on the right leg.\nInput:\nThe patient's blood pressure is 160/120 mmHg on"
  },
  "extraction_per_page": [
    {
      "extraction": {
        "clinical_info": {
          "diagnosis": [
            "fever"
          ],
          "icd_codes": [],
          "lab_results": {},
          "notes": null,
          "vital_signs": {}
        },
        "medications": [
          {
            "confidence": 0.85,
            "dosage": null,
            "duration": null,
            "form": null,
            "frequency": "bid",
            "instructions": "The patient was prescribed Amoxicillin 500mg bid.",
            "name": "The",
            "quantity": null,
            "refills": null,
            "route": null,
            "strength": "500mg"
          },
          {
            "confidence": 0.85,
            "dosage": null,
            "duration": null,
            "form": null,
            "frequency": "bid",
            "instructions": "The patient was prescribed Amoxicillin 500mg bid.",
            "name": "The",
            "quantity": null,
            "refills": null,
            "route": null,
            "strength": "500mg"
          },
          {
            "confidence": 0.85,
            "dosage": null,
            "duration": null,
            "form": null,
            "frequency": "daily",
            "instructions": "The patient's medication list includes Lisinopril 10mg daily and Metformin 500mg twice a day.",
            "name": "The",
            "quantity": null,
            "refills": null,
            "route": null,
            "strength": "10mg"
          },
          {
            "confidence": 0.85,
            "dosage": null,
            "duration": null,
            "form": null,
            "frequency": "daily",
            "instructions": "The patient's medication list includes Lisinopril 10mg daily and Metformin 500mg twice a day.",
            "name": "The",
            "quantity": null,
            "refills": null,
            "route": null,
            "strength": "10mg"
          },
          {
            "confidence": 0.85,
            "dosage": null,
            "duration": null,
            "form": null,
            "frequency": null,
            "instructions": "The patient's blood glucose level is 120 mg/dL.",
            "name": "The",
            "quantity": null,
            "refills": null,
            "route": null,
            "strength": "120mg"
          },
          {
            "confidence": 0.85,
            "dosage": null,
            "duration": null,
            "form": null,
            "frequency": null,
            "instructions": "The patient's blood glucose level is 120 mg/dL.",
            "name": "The",
            "quantity": null,
            "refills": null,
            "route": null,
            "strength": "120mg"
          },
          {
            "confidence": 0.85,
            "dosage": null,
            "duration": null,
            "form": null,
            "frequency": null,
            "instructions": "The patient's urine output is 500 mL over the past 8 hours.",
            "name": "The",
            "quantity": null,
            "refills": null,
            "route": null,
            "strength": "500mL"
          },
          {
            "confidence": 0.85,
            "dosage": null,
            "duration": null,
            "form": null,
            "frequency": null,
            "instructions": "The patient's urine output is 500 mL over the past 8 hours.",
            "name": "The",
            "quantity": null,
            "refills": null,
            "route": null,
            "strength": "500mL"
          }
        ],
        "metadata": {
          "date_filled": null,
          "date_written": null,
          "expiration_date": null,
          "is_electronic": false,
          "is_original": true,
          "language": "en",
          "prescription_number": null,
          "prescription_type": "standard"
        },
        "ml_entities_count": 0,
        "patient": {
          "address": null,
          "age": null,
          "allergies": [
            "status is unknown."
          ],
          "dob": null,
          "gender": null,
          "id": null,
          "insurance": null,
          "name": "was prescribed Amoxicillin",
          "phone": null
        },
        "pharmacy": {
          "address": null,
          "license": null,
          "name": null,
          "phone": null
        },
        "prescriber": {
          "address": null,
          "dea": null,
          "id": null,
          "license": null,
          "name": "the ab",
          "npi": null,
          "phone": null,
          "signature_present": false,
          "specialty": null
        },
        "refined_text": "A\nInput:\nTis a phisical examination of the abdominal area.\nCleaned:\nThis is a physical examination of the abdominal area.\nInput:\nThe patient was prescribed Amoxicillin 500mg bid.\nCleaned:\nThe patient was prescribed Amoxicillin 500mg bid.\nInput:\neaning from a recent fall, the patient presents with a suspected fracture of the left femur.\nCleaned:\nEarning from a recent fall, the patient presents with a suspected fracture of the left femur.\nInput:\nThe patient's symptoms include a mild headache and a slight fever.\nCleaned:\nThe patient's symptoms include a mild headache and a slight fever.\nInput:\nThe patient's vitals are stable, and he is in no acute distress.\nCleaned:\nThe patient's vitals are stable, and he is in no acute distress.\nInput:\nThe patient's ECG shows normal sinus rhythm with no significant ST-T changes.\nCleaned:\nThe patient's ECG shows normal sinus rhythm with no significant ST-T changes.\nInput:\nThe patient's blood pressure is 120/80 mmHg, and his pulse is 72 bpm.\nCleaned:\nThe patient's blood pressure is 120/80 mmHg, and his pulse is 72 bpm.\nInput:\nThe patient's lab results indicate elevated liver enzymes.\nCleaned:\nThe patient's lab results indicate elevated liver enzymes.\nInput:\nThe patient's history of present illness includes a persistent cough for the past two weeks.\nCleaned:\nThe patient's history of present illness includes a persistent cough for the past two weeks.\nInput:\nThe patient's medication list includes Lisinopril 10mg daily and Metformin 500mg twice a day.\nCleaned:\nThe patient's medication list includes Lisinopril 10mg daily and Metformin 500mg twice a day.\nInput:\nThe patient's family history is significant for hypertension and diabetes mellitus.\nCleaned:\nThe patient's family history is significant for hypertension and diabetes mellitus.\nInput:\nThe patient's chief complaint is shortness of breath and chest pain.\nCleaned:\nThe patient's chief complaint is shortness of breath and chest pain.\nInput:\nThe patient's allergy status is unknown.\nCleaned:\nThe patient's allergy status is unknown.\nInput:\nThe patient's social history includes smoking and occasional alcohol use.\nCleaned:\nThe patient's social history includes smoking and occasional alcohol use.\nInput:\nThe patient's current medications include \nCleaned:\nThe patient's current medications include \nInput:\nThe patient's last menstrual period was 6 weeks ago.\nCleaned:\nThe patient's last menstrual period was 6 weeks ago.\nInput:\nThe patient's physical examination reveals bilateral lower extremity edema.\nCleaned:\nThe patient's physical examination reveals bilateral lower extremity edema.\nInput:\nThe patient's neurological examination is normal.\nCleaned:\nThe patient's neurological examination is normal.\nInput:\nThe patient's oxygen saturation is 98% on room air.\nCleaned:\nThe patient's oxygen saturation is 98% on room air.\nInput:\nThe patient's respiratory rate is 16 breaths per minute.\nCleaned:\nThe patient's respiratory rate is 16 breaths per minute.\nInput:\nThe patient's temperature is 98.6\u00b0F.\nCleaned:\nThe patient's temperature is 98.6\u00b0F.\nInput:\nThe patient's weight is 180 pounds.\nCleaned:\nThe patient's weight is 180 pounds.\nInput:\nThe patient's height is 5 feet 10 inches.\nCleaned:\nThe patient's height is 5 feet 10 inches.\nInput:\nThe patient's blood glucose level is 120 mg/dL.\nCleaned:\nThe patient's blood glucose level is 120 mg/dL.\nInput:\nThe patient's urine output is 500 mL over the past 8 hours.\nCleaned:\nThe patient's urine output is 500 mL over the past 8 hours.\nInput:\nThe patient's skin turgor is normal.\nCleaned:\nThe patient's skin turgor is normal.\nInput:\nThe patient's blood pressure is 130/85 mmHgon the left arm.\nCleaned:\nThe patient's blood pressure is 130/85 mmHg on the left arm.\nInput:\nThe patient's blood pressure is 125/80 mmHg on the right arm.\nCleaned:\nThe patient's blood pressure is 125/80 mmHg on the right arm.\nInput:\nThe patient's blood pressure is 110/70 mmHg on the left leg.\nCleaned:\nThe patient's blood pressure is 110/70 mmHg on the left leg.\nInput:\nThe patient's blood pressure is 115/75 mmHg on the right leg.\nCleaned:\nThe patient's blood pressure is 115/75 mmHg on the right leg.\nInput:\nThe patient's blood pressure is 120/80 mmHg on the left arm.\nCleaned:\nThe patient's blood pressure is 120/80 mmHg on the left arm.\nInput:\nThe patient's blood pressure is 125/85 mmHg on the right arm.\nCleaned:\nThe patient's blood pressure is 125/85 mmHg on the right arm.\nInput:\nThe patient's blood pressure is 130/90 mmHg on the left leg.\nCleaned:\nThe patient's blood pressure is 130/90 mmHg on the left leg.\nInput:\nThe patient's blood pressure is 135/95 mmHg on the right leg.\nCleaned:\nThe patient's blood pressure is 135/95 mmHg on the right leg.\nInput:\nThe patient's blood pressure is 140/100 mmHg on the left arm.\nCleaned:\nThe patient's blood pressure is 140/100 mmHg on the left arm.\nInput:\nThe patient's blood pressure is 145/105 mmHg on the right arm.\nCleaned:\nThe patient's blood pressure is 145/105 mmHg on the right arm.\nInput:\nThe patient's blood pressure is 150/110 mmHg on the left leg.\nCleaned:\nThe patient's blood pressure is 150/110 mmHg on the left leg.\nInput:\nThe patient's blood pressure is 155/115 mmHg on the right leg.\nCleaned:\nThe patient's blood pressure is 155/115 mmHg on the right leg.\nInput:\nThe patient's blood pressure is 160/120 mmHg on"
      },
      "page": 0
    }
  ],
  "meta": {
    "api_version": "3.0 + LLM",
    "ml_entities_detected": 0,
    "page_count": 1,
    "processing_timestamp": "2025-11-15T08:21:53.516435Z",
    "total_text_regions": 3
  },
  "ocr_confidence": 0.805634,
  "ocr_raw": {
    "page_0": [
      {
        "confidence": 0.7656291127204895,
        "text": "\u00e0"
      },
      {
        "confidence": 0.6734222173690796,
        "text": "\u00e0"
      },
      {
        "confidence": 0.977850615978241,
        "text": "A"
      }
    ]
  },
  "ocr_text": "\u00e0\n\u00e0\nA",
  "ocr_text_length": 5,
  "routing_decision": {
    "action": "MANUAL_REVIEW",
    "priority": "high",
    "reason": "Missing critical fields: patient.id",
    "requires_pharmacist_review": false
  },
  "success": true,
  "validation": {
    "completeness_score": 0.75,
    "missing_critical_fields": [
      "patient.id"
    ],
    "quality_score": 0.805634,
    "validation_status": "PENDING_REVIEW"
  }
}